メンバー,レアリティ,カード名,リンク,入手時,特訓時,特訓1回目,特訓2回目,ライブ開始,スキル発動,スキル発動(クロスボイス),SP発動
百生吟子,UR,Link to the FUTURE,https://wikiwiki.jp/llll_wiki/%EF%BC%BBLink%20to%20the%20FUTURE%EF%BC%BD%E7%99%BE%E7%94%9F%E5%90%9F%E5%AD%90,次は見ててよ、桂城泉！私、悔しかった。あの人に、あそこまで言われたこと。……言われるまで、なんにもわからなかったこと。わざと悪役になってくれたことは、感謝してる。だけど、あんなやり方、好きじゃない。好きじゃ、ないのに、それで私たちは助けられたわけで……。でも、でも……。ああ、もう！はがやしい～！,,『Link to the FUTURE』は、去年の103期に作られた曲です。大きなピンチを迎えたスクールアイドルクラブが一致団結し、大逆転するために生み出された曲だと聞きました。私も、去年のFes×LIVEを拝見しましたが、花帆先輩や梢先輩も、それはそれはひたむきで、すごい熱量が込められてて。私は、どうすればこの曲を上手に再現できるかを、ずっと考えてました。でも、気をつけるべきは、そこではなかったんだと思います。周りのみんなを信じて、自分を出し切る。それがきっと、みんなで繋がるってことなんだって、ようやくわかった気がするんです。ですから、その、私も、熱量をいっぱい込めました。ずっとスクールアイドルクラブを応援してくださっている人にも、届いたら、嬉しいです。,えーと……「蓮ノ小三角」という名前について、少し、言い訳してもいいでしょうか……。今回も言い出したのは姫芽で、小鈴もすぐに受け入れるところまでは、いつもと同じだったんですが……でも、私も流されるんじゃなくて、ちゃんとすぐに賛成しました。「蓮ノ小三角」という名前には、姫芽も小鈴も、それぞれ思うところはあるでしょうけど、私に関して言えば……。今はまだ重すぎる名前でも、これから2年生、3年生になって、この名前が似合うような3人になれればいいな、と思ってます。なんというか……これからも頑張るぞっていう、決意表明というか……。「ミライへの約束」みたいなものだと受け取っていただければ、と。私、好きなんです。102期生の先輩方の関係。いつも自分たちを高め合って、芸の道を邁進して。あんな風になりたいって、思ったから……。え、103期生の先輩方、ですか？もちろん、すごく尊敬してますけど……！私はあんな風に、人懐っこく賑やかには、できないので……！,繋がってください、私たちと、一緒に！,未来へ、響け！,,私、頑張ります！ラブライブ！
百生吟子,UR,ユメワズライ,https://wikiwiki.jp/llll_wiki/%EF%BC%BB%E3%83%A6%E3%83%A1%E3%83%AF%E3%82%BA%E3%83%A9%E3%82%A4%EF%BC%BD%E7%99%BE%E7%94%9F%E5%90%9F%E5%AD%90,ライブって楽しいですね！近くの呉服屋さんのスペースをお借りして、ライブTシャツに着替えてきました。こういうのが作法だと聞いたので、準備は万全です。今日は少しでも梢先輩の助けになればと思ってたんですが、調べているうちに私も楽しくなってきてしまって……。で、でも、一緒にいる人がムスっとしてるよりは、楽しんでる方がいいですよね。きっと。盛り上がっていきましょうね梢センパイ！いえーい！……こ、これは違いますかね……？,,私、実感したことはなかったんです。梢先輩はよく「私とあなたは似ている」と言ってくれてたんですが、ずっとピンとこなくて。でも、今回の件で初めて分かった気がします。梢先輩が抱えてる不安とか、責任感とか。思い詰めちゃうところも、たしかに私に似てるのかなって。でもそれ以上に、梢先輩は立派で優しい人だって分かってます。今回の一件を乗り越えて、改めて思います。私、実直で、誠実で、そして可愛らしい、梢先輩みたいな人になりたいです！,そういえば、聞きましたか？花帆先輩は梢先輩を励ますために、夜中、寮を抜け出したんですよ。あっ……すみません、学校にバレるとまずいので……ここだけの話で、お願いします。それで、その……はい。私が点呼をごまかしました。やり方は、昔、慈先輩にちらっと聞いたことがあって……。あっ、これもオフレコで……！そ、それにしても、すごいですよね、花帆先輩の行動力。いくら梢先輩を励ますためでも、そこまでできるなんて。……私も。来年二年生になって、先輩になったら、あんな風になれるのかな……。今までは、ずっとムリだと思ってたんです。でも、梢先輩がもう一度歌を歌おうと思ってくれたのはきっと、花帆先輩のおかげもあると、思うんです。本当に、心から、感謝してます。だけど……いつかきっと、私だって。私、これからもがんばります。いつでも見ているって、言ってくれましたから。梢先輩が！,これが104期スリーズブーケの、集大成……！,目に焼きつけますから！,,これからも歌ってください。ずっと、あなたの歌を！
百生吟子,UR,蒼のツバメ,https://wikiwiki.jp/llll_wiki/%EF%BC%BB%E8%92%BC%E3%81%AE%E3%83%84%E3%83%90%E3%83%A1%EF%BC%BD%E7%99%BE%E7%94%9F%E5%90%9F%E5%AD%90,こら、邪魔しないの姫芽。あとで遊んであげるから。花帆先輩、セラスさんもだけど、どうして宿題を貯め込んじゃうのかな。だって、いつかやらなきゃいけないことなら毎日やらなきゃ駄目じゃない。それだけ、今に全力で一生懸命ってことなのかな。……私もちょっとは見習った方が？いやいや、それはない。ない。,,今日は、みんなで撮影会に来ています。気持ちのいい空ですね。見上げた天の原色の空もこんなに綺麗で。メンバーカラーを決めてから、なんだか昔よりも青空が好きになった気がします。思い出すんですよね、ライブでみなさんが振ってくださったペンライトの色を。思えば、花帆先輩がおひさま色で、梢先輩は雨のイメージが強かったですから、そんなお二人にとって無くてはならない天の原をチョイスしたのは我ながらファインプレーだったかもしれません。いちばん星が輝くのだって天の原ですからね。え？シュガーパープルは……ええっと、うーん……ほら、綿菓子みたいに甘い雲が浮かんでいますよね！ね！,今年も、いろんなことがあった夏休みでした。毎日が本当にあっという間で、スクールアイドルクラブもみんながレベルアップできて。いい心持ちでFes×LIVEに臨めました。その中でもなんというか、最近小鈴が凄いんです！前に姫芽とも話したんだけど、小鈴って去年は空回りも多かったんですが、7月で自分のやりたいことを見つけてからはもう歯車が噛み合ったみたいにとにかく凄くて！歌もダンスもどんどん上達してて。相変わらず本人は自覚ないみたいなんですけど、だからこそ、もっと頑張らなきゃって毎日一生懸命練習してて。上達するはずですよね。友達として、どうだ小鈴は凄いんだぞ！って誇らしい反面、同じ部活のライバルとして私ももっと頑張ろうって思えるんです。えへへっ、ちょっと姫芽のテンションがうつっちゃったかな？というわけで、私も頑張るぞー、ちぇ、ちぇすとー！,今日のライブも頑張るぞー、ちぇすとー！,今日も綺麗な天の原色ですね。,,た、対戦よろしくお願いしまーす！
百生吟子,SR,Her-bath-rium,https://wikiwiki.jp/llll_wiki/%EF%BC%BBHer-bath-rium%EF%BC%BD%E7%99%BE%E7%94%9F%E5%90%9F%E5%AD%90,なんなんこの子、ほんま……。私も今年から2年生になりました。スクールアイドルクラブにも新入生が入ってきて、新しい先輩生活が始まるんだって気合を入れてたんですけど……なんか、思っとったんと違とるがいね……。,,スクールアイドルクラブに入ってもう1年。去年の今ごろは目の前のことにいっぱいいっぱいだった気がしますけど、そんな私も、ちょっとずつ余裕が出来てきた気がします。この撮影だって、去年の私だったらきっと顔を真っ赤にしてました。でも1年で沢山、いろんな衣装を撮ってもらいましたからね。今はどうすればもうちょっと写りが良くなるか、自分から提案することだってできます。小鈴や姫芽の意見も参考にして、もっと私を見てもらえるように頑張ります。スクールアイドルの私は、「私なんか」じゃありませんから！,というわけでスクールアイドル活動にはちょっとは自信もついたんですけど、それ以外のことは結構、全然、まだまだで……。スクールアイドルは刺繍と同じで、積み重ねたことが形となって目に見えるじゃないですか。努力の方向性もちゃんと決まってて。でも日常生活はなんというか、予想外の出来事の連続で。だってまさか新入部員として泉さんとセラスさんがやってくるなんて思わないじゃないですか。あ、もちろん嫌とかでは全然ないんですけど、慣れるまでちょっと時間がかかるっていうか……。私が先輩方にしてもらったように優しくしてあげたいと思ってはいるんですけど、思ってはいるんですけど……！おかしくないですか！？特にあの子！距離感が！,あ……うん。やろっか、ライブ……,きゅるん☆って……,,とびきりかわいいスリーズブーケ……って、やらんから！
百生吟子,SR,アオクハルカ,https://wikiwiki.jp/llll_wiki/%EF%BC%BB%E3%82%A2%E3%82%AA%E3%82%AF%E3%83%8F%E3%83%AB%E3%82%AB%EF%BC%BD%E7%99%BE%E7%94%9F%E5%90%9F%E5%AD%90,ああもう、はいはい、あんやと。今日は、花帆先輩を連れて、ひゃくまんさんの絵付け体験会に行ってきました。そしたら花帆先輩、自分のことそっちのけで、私の塗りばっかり褒めてきて...。もう、花帆先輩のために来たのに、意味ないじゃん。,,『アオクハルカ』。私と花帆先輩と梢先輩の3人で手掛けた曲です。といっても私は、意見を求められたときに、なんとか受け答えをしてただけですが...。なんというか、うまく言葉にはできないかもしれませんが、すごくいい曲だなって思いました。過ぎ行く日々に思いを馳せながらも、この胸に確かな繋がりを感じられて、好きです、この曲。梢先輩は何でもできますよね。作詞もお上手で、1年生からの人気もすごいんです。それは、綴理先輩も慈先輩もですけど。まるで雲の上の人みたいで、欠点なんてあるんでしょうか？あ、機械は苦手みたい...でも得意になる途中と言ってましたし、きっとすぐ上手になるんでしょうね。...えっ？イラスト、ですか？うーん...私にはよくわかりませんが、ああいう芸術、なんですよね？,スリーズブーケに入るって決めた時に、それは花帆先輩や梢先輩の隣に立って一緒にパフォーマンスすることなんだ、って、分かってはいたんです。なんですけど、やっぱりお2人はすごいので。花帆先輩も、ああ見えて、1年生の子に好かれてたりするんですよね。クラスでも、可愛い可愛いって言ってる子いたり。だから、足を引っ張ってないかなって、悩む時も、あって。ユニット的には伝統を受け継ぐこと、104期生の私がここにいることに意味があるから、と、自分を誤魔化したくなることもありますけど...。なんか、なんだろう。でも私、負けたくなくて。...負けたくないんです。誰に、とかじゃなくて。なんか、全部に。だから、やっぱり私は、百生吟子として、お2人の隣にいたいです。そのためにも精進あるのみです。千里の道も一歩から。私もそれが、走るってことだと思います。,私、負けんからね！,あ、アオハル……,,この歌も、連れていけたら、いいな。
百生吟子,SR,聖夜譚,https://wikiwiki.jp/llll_wiki/%EF%BC%BB%E8%81%96%E5%A4%9C%E8%AD%9A%EF%BC%BD%E7%99%BE%E7%94%9F%E5%90%9F%E5%AD%90,私には、ちょっと可愛すぎると思うんだけど……。この日は、花帆先輩と備品を買いに行くついでに服飾店に寄ったんですけど……。着せ替え人形にされるのは予想してました。さすがにもう、花帆先輩のパターンはわかってきたので。ただ、なんで人に「絶対似合うに決まってるよ！」とか言い切れるんでしょうか。どこからその自信が……。,,ハッピーメリークリスマス、です。この時期、金沢の市内にはいくつもイルミネーションが飾られるんですよ。どれもとっても綺麗ですので、もし近くにお越しの際はぜひ、お立ち寄りください。ふふっ、金沢の宣伝でした。ということもあり、冬のお散歩は心がうきうきします。まるで、街がいつもよりちょっとおしゃれに気を使って、華やかに着飾っているみたいで、綺麗な街並みがより一層輝いて見えます。私もハレの日を迎えて、少し着飾ってみました。雅とは違いますが、たまにはこういうのも、どう、でしょうか？,クリスマスは、実は私たち伝統職人にとっても、かき入れ時なんですよ。手作りのプレゼントとして、加賀繍のワークショップも忙しくなりますし、職人さんのお仕事もクリスマスに向けて徐々に増えていくんです。ええ、心のこもった贈り物なら、任せてください。世界にひとつだけの素敵な贈り物を、ご用意させていただきます。……あ、すみません！またなんだか、宣伝みたいになってしまって。ええと、ええと……。あ、スクールアイドルクラブでも、プレゼント交換をしました。私は部のみんなに、それぞれのアイコンの刺繍飾りがついたヘアゴムをプレゼントしたんですけど……。つい全員分用意してしまって、プレゼント交換の趣旨とは違ってしまいました……。喜んではもらえましたけど、はい。ちょっとした、失敗談でした……。あはは……。,冬の金沢、楽しんで行きまっしね。,街がほら、こんなに綺麗。,,世界に一つだけの贈り物。この歌も、そうですよ。
百生吟子,SR,Poupée en Lotus,https://wikiwiki.jp/llll_wiki/%EF%BC%BBPoup%C3%A9e%20en%20Lotus%EF%BC%BD%E7%99%BE%E7%94%9F%E5%90%9F%E5%AD%90,縫い物をしながらほっとひと息。はあ、落ち着く……。もともと実家は人の出入りが多くて忙しなかったですし、賑やかな同年代に囲まれることも日常になってきましたが、こうして一人でのんびり作業するのは格別の良さがありますね。あ、これは姫芽と小鈴のぬいぐるみに防寒着を編んであげてるんです。別に頼まれたわけじゃないんですけど、せっかくなので。,,こんにちは。百生吟子です。うーん、こういう時どういう挨拶をすればいいんでしょうね。ボンジュール？フランス人形なんかな、これ……。ともあれ、今回はこういうシチュエーションでの撮影です。私は相変わらず、金沢の街をのんびり歩くのが趣味なんですが、そうしてると新しくできたお店やスタジオによく目が向くんですよね。今回の撮影で使わせていただいたこのスタジオも前々から行ってみたいなと思ってて、小鈴や姫芽に話してみたんです。そうしたら盛り上がっちゃて、お洋服まで作ることになってしまいました。大丈夫、きっと似合ってますから。……あ、いえ、私じゃなくて、他の方々のことですが！,昔からよく「お人形さんみたい」とは言われてきましたが、セラスとかと違って私の場合は日本人形なんですよね。座敷わらしっぽいだとか、こけしみたいだとか。正直あまりよい思い出はなかったのですが、最近はちょっとずつ、この子たちのかわいさも分かってきました。きっと周りの人たちも、悪口のつもりで言ってたわけじゃないと思うんです。もともと私にはお人形さんを愛でる習慣はなかったのですが、姫芽や小鈴にゲームセンターに連れて行ってもらって、そのかわいらしさに触れて、いいなって思えるようになってきて。ここだけの話ですが、今ではもう引き出しの中にスクールアイドルクラブメンバー全員分のぬいぐるみがしまってあるんですよ。お洋服も手縫いで作って、時々着せ替えてあげたりして、かわいいんです！……あれ、私もしかしてすごくハマってますか、これ……！？,錦に花を、縫いにお衣装を、ですね。,吟子、吟子やよ。……って、何これ。,,お人形さんみたい、ですか……？ふふっ、嬉しいです！
百生吟子,SR,My Lucky Clover,https://wikiwiki.jp/llll_wiki/%EF%BC%BBMy%20Lucky%20Clover%EF%BC%BD%E7%99%BE%E7%94%9F%E5%90%9F%E5%AD%90,パッパラ、パーラパラパララ……♪百生吟子です。こちらの歌、『My Lucky Clover』は、遠征ライブに向けて、各ユニットそれぞれ、トランプのスートをモチーフに作った曲です。最初に言い出したのは花帆先輩だったんですが、それぞれ何のスートがいいか、というのは無事被らずに決まりました。各ユニット、似合ってますよね。ふふっ。泉のスペードなんて、もともと剣ですからね。まさにぴったりです。,,今回の『My Lucky Clover』は、花帆先輩が作詞をしてくれました。なので、もっと浮かれた曲が寄ってくるのかと思いきや……なんだか、素敵な雰囲気な曲ですよね。まあ、浮かれた曲も、花帆先輩らしくて可愛いなとは思うんですが。でも、「決められた普通に生まれそうでも」とか、「諦めてしまうのは、簡単なようで難しい」とか。私も共感するような歌詞がたくさんあって、やっぱり、花帆先輩は作詞が上手だなと思いました。あの人は、ただ明るくて可愛いだけではないんですよね。そういう、繊細なギャップを、私の作る歌でももうちょっと見せられたらいいんですけど。これからも、頑張りますね。,そういえばこの曲には、ちょっとしたエピソードがあるんです。花帆先輩、この曲を作る際、実際に四つ葉のクローバーを探しにいったんですよ。でもなかなか帰ってこなくて、仕方ないから私もお手伝いに行ったんです。そうしたら花帆先輩、私を見つけるなり、「吟子ちゃんが、あたしの四葉のクローバーかも」なんて言い出して。さすがにそんな曲、ダメに決まってるじゃないですか！ さすがに止めましたよ、ええ。でも、緑の絨毯にうずくまって、クローバーを探す花帆先輩って、遠目だとなんだかちょっぴり、クローバーに見えたんですよね。……ほら、髪型が似てないですか？ そんな花帆先輩に、私が加わって、二人で四つ葉のクローバーになれたらいいな、なんて。……あ……ええと、私、恥ずかしいこと言ってるような気がしてきました……！ それでは、また！,この曲を、贈ります。あなたにも、幸運を！,私だけの、ラッキークローバー。,,ふふふっ、つかっちゃいましたか。
百生吟子,R,レインボーシフォン,https://wikiwiki.jp/llll_wiki/%EF%BC%BB%E3%83%AC%E3%82%A4%E3%83%B3%E3%83%9C%E3%83%BC%E3%82%B7%E3%83%95%E3%82%A9%E3%83%B3%EF%BC%BD%E7%99%BE%E7%94%9F%E5%90%9F%E5%AD%90,お初にお目にかかります。百生吟子と申します。蓮ノ空女学院104期生、スリーズブーケの百生吟子です。先人たちの伝統を受け継いで立派なスクールアイドルになれたら、と思います。が、頑張ります。,,こ、これが今回の衣装……。フリフリでスカートが短くてこんなに脚が見えちゃって……。普段あんまりこういう恰好しないから、なんというか照れます。とはいえ、スクールアイドルクラブに入ると決めたころから覚悟はしてました。……ど、どうぞ。私のスカート姿、思う存分ご覧ください。,なんというか、見るのとやるのとは大違いって言うか。私は祖母の影響もあって昔から芸楽部に入りたくて。だから可愛い衣装を着たり歌を歌ったり踊ったりすることに憧れてたはずなんだけど……。いざ自分がやる番になるとちょっと汗が凄いことになるね。パフォーマンス中はね、集中しなきゃって思ってるから案外平気なんだけど、その後に録画した映像をみんなで見直す時とかもう、もう……。仏頂面の女の子がそこにいて、こんなの全然スクールアイドルっぽくない……。私、次回のライブまでにはちゃんと笑顔の練習もしてくるから。見ててね、みんな。,104期生百生吟子、頑張ります。,え、笑顔でポーズ。,,練習の成果、出し切るからね。
百生吟子,R,室咲格子,https://wikiwiki.jp/llll_wiki/%EF%BC%BB%E5%AE%A4%E5%92%B2%E6%A0%BC%E5%AD%90%EF%BC%BD%E7%99%BE%E7%94%9F%E5%90%9F%E5%AD%90,百生吟子、です。まいどさん。今日はちょっと、ラフな格好。さすがに練習着まで着物ってわけにはいかないからね。うん、これからスクールアイドルの練習に行ってくるんだ。それじゃあ、またね。,,衣装を着替えてみました。どうかな……？ 少しは、スクールアイドルっぽくなれた……かな？ なんだか、ちょっと面白くて。先輩方みんなね、衣装を着た後に、どうすればもっと可愛くできるのかって話をしてるんだ。髪型のアレンジとか、アクセサリーを考えたりとか。私は、衣装は作った時点で完成だと思ってたから……。でも、そうじゃないんだね。色々と、学びがある毎日、です。,「お休みの日は何をしていますか」ですか？えーと、何だろう……お部屋でずっと縫い物してるのも好きだし、お外をのんびり散歩するのも、結構好きだよ。気になったお店があったら、ふらっと覗いて見たり。うん、わりと一人でいるかも。誰かと遊びに行かないの、って？ 誰かと……えっ、誰と……？ あ、ご、ごめんなさい！ 何か変な空気にしちゃって。そうだよね、うん、せっかく高校に入ったんだし、お友達作りとかも、頑張りたいですね。とりあえずは104期生同士。小鈴さんと、姫芽さんと、仲良くできるように、その、ちょっとずつ、頑張ります。,私のステージ、どうぞご覧ください。,スクールアイドルの、第一歩！,,一番衣装が映える角度は……ここ！
